Sigla/ISSN,Título da publicação,Estrato,Tipo,SPRINGER_PROPERTY_ORG,SPRINGER_ID_ORG,SPRINGER_NAME_ORG,SPRINGER_NAME_UPPER,NAME_UPPER_ALL,MATCHING_CASE,COMMENT
ICISO,INTERNATIONAL CONFERENCE ON INFORMATICS AND SEMIOTICS IN ORGANISATIONS,B5,Conferência,http://lod.springer.com/data/ontology/property/confSeriesName,http://lod.springer.com/data/confseries/iciso,International Conference on Informatics and Semiotics in Organisations,INTERNATIONAL CONFERENCE ON INFORMATICS AND SEMIOTICS IN ORGANISATIONS,INTERNATIONAL CONFERENCE ON INFORMATICS AND SEMIOTICS IN ORGANISATIONS,by upper name,
ICISS,INTERNATIONAL CONFERENCE ON INFORMATION SYSTEMS SECURITY,B3,Conferência,http://lod.springer.com/data/ontology/property/confSeriesName,http://lod.springer.com/data/confseries/iciss,International Conference on Information Systems Security,INTERNATIONAL CONFERENCE ON INFORMATION SYSTEMS SECURITY,INTERNATIONAL CONFERENCE ON INFORMATION SYSTEMS SECURITY,by upper name,
ICITS,INTERNATIONAL CONFERENCE ON INTELLIGENT TUTORING SYSTEMS,A2,Conferência,http://lod.springer.com/data/ontology/property/confSeriesName,http://lod.springer.com/data/confseries/its,International Conference on Intelligent Tutoring Systems,INTERNATIONAL CONFERENCE ON INTELLIGENT TUTORING SYSTEMS,INTERNATIONAL CONFERENCE ON INTELLIGENT TUTORING SYSTEMS,by upper name,
ICLP,INTERNATIONAL CONFERENCE ON LOGIC PROGRAMMING,B1,Conferência,http://lod.springer.com/data/ontology/property/confSeriesName,http://lod.springer.com/data/confseries/iclp,International Conference on Logic Programming,INTERNATIONAL CONFERENCE ON LOGIC PROGRAMMING,INTERNATIONAL CONFERENCE ON LOGIC PROGRAMMING,by upper name,
ICMLC,INTERNATIONAL CONFERENCE ON MACHINE LEARNING AND CYBERNETICS,B4,Conferência,http://lod.springer.com/data/ontology/property/confSeriesName,http://lod.springer.com/data/confseries/icmlc,International Conference on Machine Learning and Cybernetics,INTERNATIONAL CONFERENCE ON MACHINE LEARNING AND CYBERNETICS,INTERNATIONAL CONFERENCE ON MACHINE LEARNING AND CYBERNETICS,by upper name,
ICN,INTERNATIONAL CONFERENCE ON NETWORKING,B1,Conferência,http://lod.springer.com/data/ontology/property/confSeriesName,http://lod.springer.com/data/confseries/icn,International Conference on Networking,INTERNATIONAL CONFERENCE ON NETWORKING,INTERNATIONAL CONFERENCE ON NETWORKING,by upper name,
ICNC,INTERNATIONAL CONFERENCE ON NATURAL COMPUTATION,B4,Conferência,http://lod.springer.com/data/ontology/property/confSeriesName,http://lod.springer.com/data/confseries/icnc,International Conference on Natural Computation,INTERNATIONAL CONFERENCE ON NATURAL COMPUTATION,INTERNATIONAL CONFERENCE ON NATURAL COMPUTATION,by upper name,
ICOIN,INTERNATIONAL CONFERENCE ON INFORMATION NETWORKING,B1,Conferência,http://lod.springer.com/data/ontology/property/confSeriesName,http://lod.springer.com/data/confseries/icoin,International Conference on Information Networking,INTERNATIONAL CONFERENCE ON INFORMATION NETWORKING,INTERNATIONAL CONFERENCE ON INFORMATION NETWORKING,by upper name,
ICONIP,INTERNATIONAL CONFERENCE ON NEURAL INFORMATION PROCESSING,B1,Conferência,http://lod.springer.com/data/ontology/property/confSeriesName,http://lod.springer.com/data/confseries/iconip,International Conference on Neural Information Processing,INTERNATIONAL CONFERENCE ON NEURAL INFORMATION PROCESSING,INTERNATIONAL CONFERENCE ON NEURAL INFORMATION PROCESSING,by upper name,
ICPP,INTERNATIONAL CONFERENCE ON PARALLEL PROCESSING,A2,Conferência,http://lod.springer.com/data/ontology/property/confSeriesName,http://lod.springer.com/data/confseries/conpar,International Conference on Parallel Processing,INTERNATIONAL CONFERENCE ON PARALLEL PROCESSING,INTERNATIONAL CONFERENCE ON PARALLEL PROCESSING,by upper name,
ICT,INTERNATIONAL CONFERENCE ON TELECOMMUNICATIONS,B2,Conferência,http://lod.springer.com/data/ontology/property/confSeriesName,http://lod.springer.com/data/confseries/ict,International Conference on Telecommunications,INTERNATIONAL CONFERENCE ON TELECOMMUNICATIONS,INTERNATIONAL CONFERENCE ON TELECOMMUNICATIONS,by upper name,
ICTSS,IFIP INTERNATIONAL CONFERENCE ON TESTING SOFTWARE AND SYSTEMS,B1,Conferência,http://lod.springer.com/data/ontology/property/confSeriesName,http://lod.springer.com/data/confseries/pts,IFIP International Conference on Testing Software and Systems,IFIP INTERNATIONAL CONFERENCE ON TESTING SOFTWARE AND SYSTEMS,IFIP INTERNATIONAL CONFERENCE ON TESTING SOFTWARE AND SYSTEMS,by upper name,
ICVS,INTERNATIONAL CONFERENCE ON COMPUTER VISION SYSTEMS,B1,Conferência,http://lod.springer.com/data/ontology/property/confSeriesName,http://lod.springer.com/data/confseries/icvs,International Conference on Computer Vision Systems,INTERNATIONAL CONFERENCE ON COMPUTER VISION SYSTEMS,INTERNATIONAL CONFERENCE ON COMPUTER VISION SYSTEMS,by upper name,
ICVS_A,INTERNATIONAL CONFERENCE ON VIRTUAL STORYTELLING,B2,Conferência,http://lod.springer.com/data/ontology/property/confSeriesName,http://lod.springer.com/data/confseries/storytelling,International Conference on Virtual Storytelling,INTERNATIONAL CONFERENCE ON VIRTUAL STORYTELLING,INTERNATIONAL CONFERENCE ON VIRTUAL STORYTELLING,by upper name,
ICWE,INTERNATIONAL CONFERENCE ON WEB ENGINEERING,B1,Conferência,http://lod.springer.com/data/ontology/property/confSeriesName,http://lod.springer.com/data/confseries/icwe,International Conference on Web Engineering,INTERNATIONAL CONFERENCE ON WEB ENGINEERING,INTERNATIONAL CONFERENCE ON WEB ENGINEERING,by upper name,
IDEAL,INTERNATIONAL CONFERENCE ON INTELLIGENT DATA ENGINEERING AND AUTOMATED LEARNING,B2,Conferência,http://lod.springer.com/data/ontology/property/confSeriesName,http://lod.springer.com/data/confseries/ideal,International Conference on Intelligent Data Engineering and Automated Learning,INTERNATIONAL CONFERENCE ON INTELLIGENT DATA ENGINEERING AND AUTOMATED LEARNING,INTERNATIONAL CONFERENCE ON INTELLIGENT DATA ENGINEERING AND AUTOMATED LEARNING,by upper name,
IESS,INTERNATIONAL CONFERENCE ON EXPLORING SERVICES SCIENCE,B4,Conferência,http://lod.springer.com/data/ontology/property/confSeriesName,http://lod.springer.com/data/confseries/icexss,International Conference on Exploring Services Science,INTERNATIONAL CONFERENCE ON EXPLORING SERVICES SCIENCE,INTERNATIONAL CONFERENCE ON EXPLORING SERVICES SCIENCE,by upper name,
IFM,INTERNATIONAL CONFERENCE ON INTEGRATED FORMAL METHODS,B1,Conferência,http://lod.springer.com/data/ontology/property/confSeriesName,http://lod.springer.com/data/confseries/ifm,International Conference on Integrated Formal Methods,INTERNATIONAL CONFERENCE ON INTEGRATED FORMAL METHODS,INTERNATIONAL CONFERENCE ON INTEGRATED FORMAL METHODS,by upper name,
ILP,INTERNATIONAL CONFERENCE ON INDUCTIVE LOGIC PROGRAMMING,B1,Conferência,http://lod.springer.com/data/ontology/property/confSeriesName,http://lod.springer.com/data/confseries/ilp,International Conference on Inductive Logic Programming,INTERNATIONAL CONFERENCE ON INDUCTIVE LOGIC PROGRAMMING,INTERNATIONAL CONFERENCE ON INDUCTIVE LOGIC PROGRAMMING,by upper name,
IVA,INTERNATIONAL CONFERENCE ON INTELLIGENT VIRTUAL AGENTS,B1,Conferência,http://lod.springer.com/data/ontology/property/confSeriesName,http://lod.springer.com/data/confseries/iva,International Conference on Intelligent Virtual Agents,INTERNATIONAL CONFERENCE ON INTELLIGENT VIRTUAL AGENTS,INTERNATIONAL CONFERENCE ON INTELLIGENT VIRTUAL AGENTS,by upper name,
KSEM,"INTERNATIONAL CONFERENCE ON KNOWLEDGE SCIENCE, ENGINEERING AND MANAGEMENT",B3,Conferência,http://lod.springer.com/data/ontology/property/confSeriesName,http://lod.springer.com/data/confseries/ksem,"International Conference on Knowledge Science, Engineering and Management","INTERNATIONAL CONFERENCE ON KNOWLEDGE SCIENCE, ENGINEERING AND MANAGEMENT","INTERNATIONAL CONFERENCE ON KNOWLEDGE SCIENCE, ENGINEERING AND MANAGEMENT",by upper name,
MCM,INTERNATIONAL CONFERENCE ON MATHEMATICS AND COMPUTATION IN MUSIC,B4,Conferência,http://lod.springer.com/data/ontology/property/confSeriesName,http://lod.springer.com/data/confseries/mcm2,International Conference on Mathematics and Computation in Music,INTERNATIONAL CONFERENCE ON MATHEMATICS AND COMPUTATION IN MUSIC,INTERNATIONAL CONFERENCE ON MATHEMATICS AND COMPUTATION IN MUSIC,by upper name,
MICAI,MEXICAN INTERNATIONAL CONFERENCE ON ARTIFICIAL INTELLIGENCE,B2,Conferência,http://lod.springer.com/data/ontology/property/confSeriesName,http://lod.springer.com/data/confseries/micai,Mexican International Conference on Artificial Intelligence,MEXICAN INTERNATIONAL CONFERENCE ON ARTIFICIAL INTELLIGENCE,MEXICAN INTERNATIONAL CONFERENCE ON ARTIFICIAL INTELLIGENCE,by upper name,
MOBIMEDIA,INTERNATIONAL CONFERENCE ON MOBILE MULTIMEDIA COMMUNICATIONS,B4,Conferência,http://lod.springer.com/data/ontology/property/confSeriesName,http://lod.springer.com/data/confseries/mobimedia,International Conference on Mobile Multimedia Communications,INTERNATIONAL CONFERENCE ON MOBILE MULTIMEDIA COMMUNICATIONS,INTERNATIONAL CONFERENCE ON MOBILE MULTIMEDIA COMMUNICATIONS,by upper name,
MPC,INTERNATIONAL CONFERENCE ON MATHEMATICS OF PROGRAM CONSTRUCTION,B1,Conferência,http://lod.springer.com/data/ontology/property/confSeriesName,http://lod.springer.com/data/confseries/mpc,International Conference on Mathematics of Program Construction,INTERNATIONAL CONFERENCE ON MATHEMATICS OF PROGRAM CONSTRUCTION,INTERNATIONAL CONFERENCE ON MATHEMATICS OF PROGRAM CONSTRUCTION,by upper name,
NPC,IFIP INTERNATIONAL CONFERENCE ON NETWORK AND PARALLEL COMPUTING,B3,Conferência,http://lod.springer.com/data/ontology/property/confSeriesName,http://lod.springer.com/data/confseries/npc,IFIP International Conference on Network and Parallel Computing,IFIP INTERNATIONAL CONFERENCE ON NETWORK AND PARALLEL COMPUTING,IFIP INTERNATIONAL CONFERENCE ON NETWORK AND PARALLEL COMPUTING,by upper name,
OPODIS,INTERNATIONAL CONFERENCE ON PRINCIPLES OF DISTRIBUTED SYSTEMS,B2,Conferência,http://lod.springer.com/data/ontology/property/confSeriesName,http://lod.springer.com/data/confseries/opodis,International Conference on Principles of Distributed Systems,INTERNATIONAL CONFERENCE ON PRINCIPLES OF DISTRIBUTED SYSTEMS,INTERNATIONAL CONFERENCE ON PRINCIPLES OF DISTRIBUTED SYSTEMS,by upper name,
PAKM,INTERNATIONAL CONFERENCE ON PRACTICAL ASPECTS OF KNOWLEDGE MANAGEMENT,B2,Conferência,http://lod.springer.com/data/ontology/property/confSeriesName,http://lod.springer.com/data/confseries/pakm,International Conference on Practical Aspects of Knowledge Management,INTERNATIONAL CONFERENCE ON PRACTICAL ASPECTS OF KNOWLEDGE MANAGEMENT,INTERNATIONAL CONFERENCE ON PRACTICAL ASPECTS OF KNOWLEDGE MANAGEMENT,by upper name,
PATAT,INTERNATIONAL CONFERENCE ON THE PRACTICE AND THEORY OF AUTOMATED TIMETABLING,B3,Conferência,http://lod.springer.com/data/ontology/property/confSeriesName,http://lod.springer.com/data/confseries/patat,International Conference on the Practice and Theory of Automated Timetabling,INTERNATIONAL CONFERENCE ON THE PRACTICE AND THEORY OF AUTOMATED TIMETABLING,INTERNATIONAL CONFERENCE ON THE PRACTICE AND THEORY OF AUTOMATED TIMETABLING,by upper name,
PERVASIVE,INTERNATIONAL CONFERENCE ON PERVASIVE COMPUTING,A2,Conferência,http://lod.springer.com/data/ontology/property/confSeriesName,http://lod.springer.com/data/confseries/pervasive,International Conference on Pervasive Computing,INTERNATIONAL CONFERENCE ON PERVASIVE COMPUTING,INTERNATIONAL CONFERENCE ON PERVASIVE COMPUTING,by upper name,
PROFES,INTERNATIONAL CONFERENCE ON PRODUCT FOCUSED SOFTWARE PROCESS IMPROVEMENT,B1,Conferência,http://lod.springer.com/data/ontology/property/confSeriesName,http://lod.springer.com/data/confseries/profes,International Conference on Product Focused Software Process Improvement,INTERNATIONAL CONFERENCE ON PRODUCT FOCUSED SOFTWARE PROCESS IMPROVEMENT,INTERNATIONAL CONFERENCE ON PRODUCT FOCUSED SOFTWARE PROCESS IMPROVEMENT,by upper name,
PWC,IFIP INTERNATIONAL CONFERENCE ON PERSONAL WIRELESS COMMUNICATIONS,B1,Conferência,http://lod.springer.com/data/ontology/property/confSeriesName,http://lod.springer.com/data/confseries/pwc,IFIP International Conference on Personal Wireless Communications,IFIP INTERNATIONAL CONFERENCE ON PERSONAL WIRELESS COMMUNICATIONS,IFIP INTERNATIONAL CONFERENCE ON PERSONAL WIRELESS COMMUNICATIONS,by upper name,
QEST,INTERNATIONAL CONFERENCE ON QUANTITATIVE EVALUATION OF SYSTEMS,B1,Conferência,http://lod.springer.com/data/ontology/property/confSeriesName,http://lod.springer.com/data/confseries/qest,International Conference on Quantitative Evaluation of Systems,INTERNATIONAL CONFERENCE ON QUANTITATIVE EVALUATION OF SYSTEMS,INTERNATIONAL CONFERENCE ON QUANTITATIVE EVALUATION OF SYSTEMS,by upper name,
RR,INTERNATIONAL CONFERENCE ON WEB REASONING AND RULE SYSTEMS,B3,Conferência,http://lod.springer.com/data/ontology/property/confSeriesName,http://lod.springer.com/data/confseries/rr,International Conference on Web Reasoning and Rule Systems,INTERNATIONAL CONFERENCE ON WEB REASONING AND RULE SYSTEMS,INTERNATIONAL CONFERENCE ON WEB REASONING AND RULE SYSTEMS,by upper name,
RTA,INTERNATIONAL CONFERENCE ON REWRITING TECHNIQUES AND APPLICATIONS,B1,Conferência,http://lod.springer.com/data/ontology/property/confSeriesName,http://lod.springer.com/data/confseries/rta,International Conference on Rewriting Techniques and Applications,INTERNATIONAL CONFERENCE ON REWRITING TECHNIQUES AND APPLICATIONS,INTERNATIONAL CONFERENCE ON REWRITING TECHNIQUES AND APPLICATIONS,by upper name,
SAB,INTERNATIONAL CONFERENCE ON SIMULATION OF ADAPTIVE BEHAVIOR,B2,Conferência,http://lod.springer.com/data/ontology/property/confSeriesName,http://lod.springer.com/data/confseries/sab,International Conference on Simulation of Adaptive Behavior,INTERNATIONAL CONFERENCE ON SIMULATION OF ADAPTIVE BEHAVIOR,INTERNATIONAL CONFERENCE ON SIMULATION OF ADAPTIVE BEHAVIOR,by upper name,
SAT,INTERNATIONAL CONFERENCE ON THEORY AND APPLICATIONS OF SATISFIABILITY TESTING,B1,Conferência,http://lod.springer.com/data/ontology/property/confSeriesName,http://lod.springer.com/data/confseries/sat,International Conference on Theory and Applications of Satisfiability Testing,INTERNATIONAL CONFERENCE ON THEORY AND APPLICATIONS OF SATISFIABILITY TESTING,INTERNATIONAL CONFERENCE ON THEORY AND APPLICATIONS OF SATISFIABILITY TESTING,by upper name,
SCN,INTERNATIONAL CONFERENCE ON SECURITY IN COMMUNICATION NETWORKS,B2,Conferência,http://lod.springer.com/data/ontology/property/confSeriesName,http://lod.springer.com/data/confseries/scn,International Conference on Security in Communication Networks,INTERNATIONAL CONFERENCE ON SECURITY IN COMMUNICATION NETWORKS,INTERNATIONAL CONFERENCE ON SECURITY IN COMMUNICATION NETWORKS,by upper name,
SLE,INTERNATIONAL CONFERENCE ON SOFTWARE LANGUAGE ENGINEERING,B5,Conferência,http://lod.springer.com/data/ontology/property/confSeriesName,http://lod.springer.com/data/confseries/sle,International Conference on Software Language Engineering,INTERNATIONAL CONFERENCE ON SOFTWARE LANGUAGE ENGINEERING,INTERNATIONAL CONFERENCE ON SOFTWARE LANGUAGE ENGINEERING,by upper name,
SSDBM,INTERNATIONAL CONFERENCE ON SCIENTIFIC AND STATISTICAL DATABASE MANAGEMENT,A2,Conferência,http://lod.springer.com/data/ontology/property/confSeriesName,http://lod.springer.com/data/confseries/ssdbm,International Conference on Scientific and Statistical Database Management,INTERNATIONAL CONFERENCE ON SCIENTIFIC AND STATISTICAL DATABASE MANAGEMENT,INTERNATIONAL CONFERENCE ON SCIENTIFIC AND STATISTICAL DATABASE MANAGEMENT,by upper name,
TACAS,INTERNATIONAL CONFERENCE ON TOOLS AND ALGORITHMS FOR THE CONSTRUCTION AND ANALYSIS OF SYSTEMS,A1,Conferência,http://lod.springer.com/data/ontology/property/confSeriesName,http://lod.springer.com/data/confseries/tacas,International Conference on Tools and Algorithms for the Construction and Analysis of Systems,INTERNATIONAL CONFERENCE ON TOOLS AND ALGORITHMS FOR THE CONSTRUCTION AND ANALYSIS OF SYSTEMS,INTERNATIONAL CONFERENCE ON TOOLS AND ALGORITHMS FOR THE CONSTRUCTION AND ANALYSIS OF SYSTEMS,by upper name,
TEAA,INTERNATIONAL CONFERENCE ON TRENDS IN ENTERPRISE APPLICATION ARCHITECTURE,B4,Conferência,http://lod.springer.com/data/ontology/property/confSeriesName,http://lod.springer.com/data/confseries/teaa,International Conference on Trends in Enterprise Application Architecture,INTERNATIONAL CONFERENCE ON TRENDS IN ENTERPRISE APPLICATION ARCHITECTURE,INTERNATIONAL CONFERENCE ON TRENDS IN ENTERPRISE APPLICATION ARCHITECTURE,by upper name,
TPDL,INTERNATIONAL CONFERENCE ON THEORY AND PRACTICE OF DIGITAL LIBRARIES,B1,Conferência,http://lod.springer.com/data/ontology/property/confSeriesName,http://lod.springer.com/data/confseries/ercimdl,International Conference on Theory and Practice of Digital Libraries,INTERNATIONAL CONFERENCE ON THEORY AND PRACTICE OF DIGITAL LIBRARIES,INTERNATIONAL CONFERENCE ON THEORY AND PRACTICE OF DIGITAL LIBRARIES,by upper name,
TPHOLS,INTERNATIONAL CONFERENCE ON THEOREM PROVING IN HIGHER ORDER LOGICS,B1,Conferência,http://lod.springer.com/data/ontology/property/confSeriesName,http://lod.springer.com/data/confseries/tphol,International Conference on Theorem Proving in Higher Order Logics,INTERNATIONAL CONFERENCE ON THEOREM PROVING IN HIGHER ORDER LOGICS,INTERNATIONAL CONFERENCE ON THEOREM PROVING IN HIGHER ORDER LOGICS,by upper name,
UBICOMP,INTERNATIONAL CONFERENCE ON UBIQUITOUS COMPUTING,A1,Conferência,http://lod.springer.com/data/ontology/property/confSeriesName,http://lod.springer.com/data/confseries/huc,International Conference on Ubiquitous Computing,INTERNATIONAL CONFERENCE ON UBIQUITOUS COMPUTING,INTERNATIONAL CONFERENCE ON UBIQUITOUS COMPUTING,by upper name,
UIC,INTERNATIONAL CONFERENCE ON UBIQUITOUS INTELLIGENCE AND COMPUTING,B2,Conferência,http://lod.springer.com/data/ontology/property/confSeriesName,http://lod.springer.com/data/confseries/uic,International Conference on Ubiquitous Intelligence and Computing,INTERNATIONAL CONFERENCE ON UBIQUITOUS INTELLIGENCE AND COMPUTING,INTERNATIONAL CONFERENCE ON UBIQUITOUS INTELLIGENCE AND COMPUTING,by upper name,
VSMM,INTERNATIONAL CONFERENCE ON VIRTUAL SYSTEMS AND MULTIMEDIA,B3,Conferência,http://lod.springer.com/data/ontology/property/confSeriesName,http://lod.springer.com/data/confseries/vsmm,International Conference on Virtual Systems and Multimedia,INTERNATIONAL CONFERENCE ON VIRTUAL SYSTEMS AND MULTIMEDIA,INTERNATIONAL CONFERENCE ON VIRTUAL SYSTEMS AND MULTIMEDIA,by upper name,
WEBIST,INTERNATIONAL CONFERENCE ON WEB INFORMATION SYSTEMS AND TECHNOLOGIES,B3,Conferência,http://lod.springer.com/data/ontology/property/confSeriesName,http://lod.springer.com/data/confseries/webist,International Conference on Web Information Systems and Technologies,INTERNATIONAL CONFERENCE ON WEB INFORMATION SYSTEMS AND TECHNOLOGIES,INTERNATIONAL CONFERENCE ON WEB INFORMATION SYSTEMS AND TECHNOLOGIES,by upper name,
WISE,INTERNATIONAL CONFERENCE ON WEB INFORMATION SYSTEMS ENGINEERING,B1,Conferência,http://lod.springer.com/data/ontology/property/confSeriesName,http://lod.springer.com/data/confseries/wise,International Conference on Web Information Systems Engineering,INTERNATIONAL CONFERENCE ON WEB INFORMATION SYSTEMS ENGINEERING,INTERNATIONAL CONFERENCE ON WEB INFORMATION SYSTEMS ENGINEERING,by upper name,
